Type,Description,Symptoms,Medicine
"akiec","Precancerous skin lesions caused by sun damage; can progress to squamous cell carcinoma","Rough, scaly patches on sun-exposed areas such as face, scalp, arms; may itch or burn","Topical medications like 5-fluorouracil, imiquimod; cryotherapy; photodynamic therapy"
"bcc","Most common type of skin cancer originating in basal cells of the skin's outer layer","Pearly or waxy bump, flat, flesh-colored or brown scar-like lesion, bleeding, scabbing, itching","Surgery (excision, Mohs surgery), cryotherapy, radiation therapy, topical medications like imiquimod"
"bkl","Non-cancerous skin growths characterized by an overgrowth of keratinocytes","Dark, raised spots (solar lentigines), wart-like growths (seborrheic keratoses), thick, scaly patches (lichen-planus like keratoses)","Usually not treated unless for cosmetic reasons; cryotherapy, curettage, laser therapy for removal if desired"
"df","Benign skin growth composed of fibrous tissue","Firm, raised bump on the skin, often brownish in color, may dimple when pinched","Usually not treated unless for cosmetic reasons; surgical excision if necessary"
"mel","Aggressive skin cancer arising from melanocytes, the pigment-producing cells","Irregularly shaped moles or spots, changes in color, size, or shape, itching, bleeding, ulceration","Surgery (wide excision, sentinel lymph node biopsy), chemotherapy, immunotherapy, targeted therapy, radiation therapy"
"nv","Common benign moles composed of melanocytes","Small, symmetrical, uniform-colored spots on the skin","Usually not treated unless for cosmetic reasons; surgical excision if necessary"
"vasc","Abnormal clusters of blood vessels near the skin's surface","Red or purple bumps, often raised, may bleed or be tender","Surgical removal, laser therapy, electrosurgery, cryotherapy"
